{
  "schema_version": "card-behavior-manifest.v1",
  "manifest_id": "manifest:ea2d35c451f26518b95679ac",
  "pack_id": "global-core-origins-v1",
  "status": "draft",
  "ruleset": {
    "core": "2026-10-09",
    "faq_as_of": "2026-08-14"
  },
  "environment": {
    "environment_id": "global-core-origins-v1",
    "region": "global",
    "formats": [
      "proving_grounds_product_practice"
    ]
  },
  "verified_at": "2026-08-17",
  "cards": [
    {
      "card_key": "annie - dark child (starter)",
      "canonical_name": "Annie - Dark Child (Starter)",
      "current_text_hash": "sha256:223039b25137d7fb61ada0b65c6c17bfaff4178e8767cbc1c4fbc56fe13b7928",
      "printing_ids": [
        "ogs-017-024",
        "opp-017-024"
      ],
      "behavior_status": "stale",
      "clauses": [
        {
          "clause_id": "annie - dark child (starter)#223039b2",
          "source_id": "origins-errata-2025-10-28",
          "locator": "ogs-017-024:223039b2",
          "text_hash": "sha256:223039b25137d7fb61ada0b65c6c17bfaff4178e8767cbc1c4fbc56fe13b7928",
          "status": "stale",
          "program_id": null,
          "implemented_ops": [],
          "unsupported_mechanics": [
            "end_of_turn_trigger"
          ],
          "test_ids": [],
          "notes": "C-25 derived: bundled snapshot still carries pre-errata wording; program written against errata text awaits reverification. passive state, probed by fixtures. text: At the end of your turn, ready up to 2 runes. | rules: Core 317.1, Core 383.1, Core 355.13"
        }
      ]
    },
    {
      "card_key": "annie - fiery",
      "canonical_name": "Annie - Fiery",
      "current_text_hash": "sha256:399be2b71aee4aadd03303d30c381e0138ba62baf1a1a52e1ecfb97930fe9214",
      "printing_ids": [
        "ogs-001-024",
        "opp-001-024"
      ],
      "behavior_status": "full",
      "clauses": [
        {
          "clause_id": "annie - fiery#24035ea0",
          "source_id": "riftcodex-cards-raw-snapshot",
          "locator": "ogs-001-024:24035ea0",
          "text_hash": "sha256:24035ea03c00f129097805ca72336fa592705524a909c77f8e5452531a15e28c",
          "status": "full",
          "program_id": "passive:annie - fiery#24035ea0",
          "implemented_ops": [],
          "unsupported_mechanics": [],
          "test_ids": [
            "annie - fiery#24035ea0:positive",
            "annie - fiery#24035ea0:negative",
            "annie - fiery#24035ea0:source_absent"
          ],
          "notes": "C-25 derived: every fixture passed, mirrored bindings agree. passive state, probed by fixtures. text: Your spells and abilities deal 1 Bonus Damage. | rules: Core 713, Core 714, Core 715.1, Core 417.6.b.2.a"
        }
      ]
    },
    {
      "card_key": "annie - stubborn",
      "canonical_name": "Annie - Stubborn",
      "current_text_hash": "sha256:5086e61a30cdd2f049264fdbcd994b6b705fbda72272aa2023411c8e12d21c9f",
      "printing_ids": [
        "ogs-010-024",
        "opp-010-024"
      ],
      "behavior_status": "full",
      "clauses": [
        {
          "clause_id": "annie - stubborn#5086e61a",
          "source_id": "riftcodex-cards-raw-snapshot",
          "locator": "ogs-010-024:5086e61a",
          "text_hash": "sha256:5086e61a30cdd2f049264fdbcd994b6b705fbda72272aa2023411c8e12d21c9f",
          "status": "full",
          "program_id": "annie - stubborn#5086e61a",
          "implemented_ops": [
            "return_to_hand"
          ],
          "unsupported_mechanics": [],
          "test_ids": [
            "annie - stubborn#5086e61a:play_entry",
            "annie - stubborn#5086e61a:play_refused",
            "annie - stubborn#5086e61a:positive",
            "annie - stubborn#5086e61a:negative",
            "annie - stubborn#5086e61a:target_invalidated"
          ],
          "notes": "C-25 derived: every fixture passed, mirrored bindings agree. passive state, probed by fixtures. text: When you play me, return a spell from your trash to your hand. | rules: Core 419.4.a, Core 355.5.b, Core 355.10.a, Core 124"
        }
      ]
    },
    {
      "card_key": "cannon barrage",
      "canonical_name": "Cannon Barrage",
      "current_text_hash": "sha256:c9ceeeb78a4db1fc90e66dbb887849a8820c138dd3e07e9dd026782520c5ac79",
      "printing_ids": [
        "ogn-127-298"
      ],
      "behavior_status": "full",
      "clauses": [
        {
          "clause_id": "cannon barrage#e7a1971e",
          "source_id": "riftcodex-cards-raw-snapshot",
          "locator": "ogn-127-298:e7a1971e",
          "text_hash": "sha256:e7a1971e3b99c1af151f7cf4720b697a3692f10dd730b2172bfb6a69fe58a9be",
          "status": "full",
          "program_id": "play:cannon barrage#e7a1971e",
          "implemented_ops": [],
          "unsupported_mechanics": [],
          "test_ids": [
            "cannon barrage#e7a1971e:positive",
            "cannon barrage#e7a1971e:negative"
          ],
          "notes": "C-18 derived: every fixture passed, mirrored bindings agree. text: [Reaction] | rules: Core 807, Core 338.1.b"
        },
        {
          "clause_id": "cannon barrage#3c6691c9",
          "source_id": "riftcodex-cards-raw-snapshot",
          "locator": "ogn-127-298:3c6691c9",
          "text_hash": "sha256:3c6691c93b2ae70c5c2b12cfae8a18dd18603868a2a01a2128fe06a2b655db68",
          "status": "full",
          "program_id": "cannon barrage#3c6691c9",
          "implemented_ops": [
            "deal_damage"
          ],
          "unsupported_mechanics": [],
          "test_ids": [
            "cannon barrage#3c6691c9:positive",
            "cannon barrage#3c6691c9:negative"
          ],
          "notes": "C-32 derived: every fixture passed, mirrored bindings agree. text: Deal 2 to all enemy units in combat. | rules: Core 740.2.c, Core 355.10.d, Core 355.5.a, Core 417.1.b"
        }
      ]
    },
    {
      "card_key": "confront",
      "canonical_name": "Confront",
      "current_text_hash": "sha256:b1ebf46a8c72b2b7a4b2aa491d9b7629a8c67f7cec1353e0027fb11966e41076",
      "printing_ids": [
        "ogn-129-298"
      ],
      "behavior_status": "full",
      "clauses": [
        {
          "clause_id": "confront#08866b32",
          "source_id": "riftcodex-cards-raw-snapshot",
          "locator": "ogn-129-298:08866b32",
          "text_hash": "sha256:08866b329d28e545ce22c394ff4c5f8680b1e341536b3a62f0c14d767e8c258d",
          "status": "full",
          "program_id": "play:confront#08866b32",
          "implemented_ops": [],
          "unsupported_mechanics": [],
          "test_ids": [
            "confront#08866b32:positive",
            "confront#08866b32:negative",
            "confront#08866b32:add_window_unconfirmed"
          ],
          "notes": "C-18 derived: every fixture passed, mirrored bindings agree. text: [Action] | rules: Core 338, Core 429.3, Core 806"
        },
        {
          "clause_id": "confront#5ee34de4",
          "source_id": "riftcodex-cards-raw-snapshot",
          "locator": "ogn-129-298:5ee34de4",
          "text_hash": "sha256:5ee34de42a71bdf3713de0ae32dec3d26c69847fcdc1c02639509304c2d165e4",
          "status": "full",
          "program_id": "confront#5ee34de4",
          "implemented_ops": [
            "grant_turn_effect"
          ],
          "unsupported_mechanics": [],
          "test_ids": [
            "confront#5ee34de4:positive",
            "confront#5ee34de4:unit_enters_ready",
            "confront#5ee34de4:negative"
          ],
          "notes": "C-25 derived: every fixture passed, mirrored bindings agree. text: Units you play this turn enter ready. | rules: Core 369.3, Core 317.2.c, Core 143.4"
        },
        {
          "clause_id": "confront#e8c50cd4",
          "source_id": "riftcodex-cards-raw-snapshot",
          "locator": "ogn-129-298:e8c50cd4",
          "text_hash": "sha256:e8c50cd480b55af4add0e6fafdab53301ceade71e9f5dbefd31b9d7b3b69a2e6",
          "status": "full",
          "program_id": "confront#e8c50cd4",
          "implemented_ops": [
            "draw"
          ],
          "unsupported_mechanics": [],
          "test_ids": [
            "confront#e8c50cd4:positive",
            "confront#e8c50cd4:negative"
          ],
          "notes": "C-18 derived: every fixture passed, mirrored bindings agree. text: Draw 1. | rules: Core 413"
        }
      ]
    },
    {
      "card_key": "disintegrate",
      "canonical_name": "Disintegrate",
      "current_text_hash": "sha256:2156f0653971761b76a6a78a675dd027c7fff8d072f97fc3ccfe0851f2b0204f",
      "printing_ids": [
        "ogn-005-298"
      ],
      "behavior_status": "stale",
      "clauses": [
        {
          "clause_id": "disintegrate#d3d94631",
          "source_id": "origins-errata-2025-10-28",
          "locator": "ogn-005-298:d3d94631",
          "text_hash": "sha256:d3d94631d44833eee89b1a6c405a1899dcb0e98cc065f3585e3383aea0bd87a2",
          "status": "stale",
          "program_id": null,
          "implemented_ops": [],
          "unsupported_mechanics": [
            "target_choice"
          ],
          "test_ids": [],
          "notes": "C-18 derived: bundled snapshot still carries pre-errata wording; program written against errata text awaits reverification. text: Deal 3 to a unit at battlefield. | rules: Core 355.5, Core 355.9.b, Core 359.3.e.5, Core 417.1.b, errata: Disintegrate OGN-005"
        },
        {
          "clause_id": "disintegrate#033ec095",
          "source_id": "origins-errata-2025-10-28",
          "locator": "ogn-005-298:033ec095",
          "text_hash": "sha256:033ec0954cf93e2e9410ac8cd28c3afeb523248e0caa1241aca58c4dcc4cbeb3",
          "status": "stale",
          "program_id": null,
          "implemented_ops": [],
          "unsupported_mechanics": [
            "conditional_effects",
            "linked_instruction"
          ],
          "test_ids": [],